,city,company_name,description,duty,employment,experience,max_salary,min_salary,name,published_date,requirements,schedule,skills,terms
228,,WantResult (ИП Пермяков Олег Владимирович),"Мы - федеральная IT-компания, специализирующаяся на увеличении продаж с юридическими гарантиями результата. В стране наступил кризис - потеря покупательской способности населения ставит многие бизнеса на грань выживания, поэтому сейчас для нас идеальное время, поскольку мы решаем ключевую задачу бизнеса - обеспечение клиентами. Мы действительно делаем свою работу хорошо, поэтому с нами работают такие бренды как: ВТБ, Ростелеком, Авилон, Тинькофф, SoftLine, BMW, ФСК Лидер, Промсвязьбанк и еще более 12,000 клиентов по России. В связи, с активным расширением компании мы ищем “Специалистов отдела продаж услуг по генерации клиентов с гарантией результата”. Влияние коронавируса на наш бизнес? Мы создали специальные Антикризисные тарифы и даем первых клиентов бесплатно, для того, чтобы поддержать и помочь бизнесу вырасти. Рост спроса на наш продукт за март 2020 вырос в 2,3 раза. Бизнесы активно активизировались, тк сейчас срочно нужно решить проблему с падением продаж. Мы не хотим рисковать вашим здоровьем, поэтому деятельность будет строиться полностью удаленно. Как строиться работа в нашей компании? 1. Мы снабжаем тебя готовой базой клиентов. Это те люди, которые в данный момент времени уже нуждаются в увеличение продаж. Необходимо качественно презентовать продукт ЛПРу и закрыть сделку. 2. Вся работа ведется в удобной CRM-системе (система учета клиентов), а звонки записываются, чтобы помочь тебе продавать больше. 3. Твоя основная задача - качественно проводить диалоги с клиентами и ставить упор на конвертацию заявок в покупателей. Какие компетенции мы ждем от тебя? • Самое главное - успешный опыт в продажах от 2 лет; • Опыт работы в продаже франшиз, digital услуг - будут являться вашим преимуществом; • Желание много зарабатывать, а не сидеть в кресле; Условия работы: Окладная часть по результатам собеседования + очень высокий проценты от продаж. Средний заработок сотрудников отдела продаж 75,000 рублей в месяц. Самый большой бонус менеджера по продажам - 485,000р за март 2020 года. Другие условия работы:  Удобный режим и график работы (5/2, 10:00 - 19:00, возможность работы из дома);  Бесплатное вводное и регулярное обучение. Мир технологий быстро меняется, и Вы будете всегда в курсе самых актуальных новинок;  Карьерный рост. Компания активно растет, если ты амбициозен, то сможешь быстро вырасти до “Ведущего менеджера” и “Руководителя отдела продаж”  В общем, если ты искал ту работу в продажах, которая позволит хорошо зарабатывать и постоянно расти - поздравляем, ты ее нашел:) Мы уверены, именно в нашей компании Вы сможете обеспечить свои амбиции) Обязательно оставляй отклик и будем уже общаться лично До связи!)",,Полная занятость,От 1 года до 3 лет,,80000,Интернет маркетинг,2020-12-24T12:46:42+0300,,Удаленная работа,B2B Продажи|Активные продажи|Холодные звонки|Телефонные переговоры|Холодные продажи|Ведение переговоров|CRM|Навыки продаж|Заключение договоров|Прямые продажи|Навыки презентации|Internet Marketing|Интернет маркетинг|,"Мы - федеральная IT-компания, специализирующаяся на увеличении продаж с юридическими гарантиями результата. В стране наступил кризис - потеря покупательской способности населения ставит многие бизнеса на грань выживания, поэтому сейчас для нас идеальное время, поскольку мы решаем ключевую задачу бизнеса - обеспечение клиентами. Мы действительно делаем свою работу хорошо, поэтому с нами работают такие бренды как: ВТБ, Ростелеком, Авилон, Тинькофф, SoftLine, BMW, ФСК Лидер, Промсвязьбанк и еще более 12,000 клиентов по России. В связи, с активным расширением компании мы ищем “Специалистов отдела продаж услуг по генерации клиентов с гарантией результата”. Влияние коронавируса на наш бизнес? Мы создали специальные Антикризисные тарифы и даем первых клиентов бесплатно, для того, чтобы поддержать и помочь бизнесу вырасти. Рост спроса на наш продукт за март 2020 вырос в 2,3 раза. Бизнесы активно активизировались, тк сейчас срочно нужно решить проблему с падением продаж. Мы не хотим рисковать вашим здоровьем, поэтому деятельность будет строиться полностью удаленно. Как строиться работа в нашей компании? 1. Мы снабжаем тебя готовой базой клиентов. Это те люди, которые в данный момент времени уже нуждаются в увеличение продаж. Необходимо качественно презентовать продукт ЛПРу и закрыть сделку. 2. Вся работа ведется в удобной CRM-системе (система учета клиентов), а звонки записываются, чтобы помочь тебе продавать больше. 3. Твоя основная задача - качественно проводить диалоги с клиентами и ставить упор на конвертацию заявок в покупателей. Какие компетенции мы ждем от тебя? • Самое главное - успешный опыт в продажах от 2 лет; • Опыт работы в продаже франшиз, digital услуг - будут являться вашим преимуществом; • Желание много зарабатывать, а не сидеть в кресле; Условия работы: Окладная часть по результатам собеседования + очень высокий проценты от продаж. Средний заработок сотрудников отдела продаж 75,000 рублей в месяц. Самый большой бонус менеджера по продажам - 485,000р за март 2020 года. Другие условия работы:  Удобный режим и график работы (5/2, 10:00 - 19:00, возможность работы из дома);  Бесплатное вводное и регулярное обучение. Мир технологий быстро меняется, и Вы будете всегда в курсе самых актуальных новинок;  Карьерный рост. Компания активно растет, если ты амбициозен, то сможешь быстро вырасти до “Ведущего менеджера” и “Руководителя отдела продаж”  В общем, если ты искал ту работу в продажах, которая позволит хорошо зарабатывать и постоянно расти - поздравляем, ты ее нашел:) Мы уверены, именно в нашей компании Вы сможете обеспечить свои амбиции) Обязательно оставляй отклик и будем уже общаться лично До связи!)"
229,,РН-БашНИПИнефть,Привет! Мы команда ,,Полная занятость,От 3 до 6 лет,150000,100000,jQuery,2021-01-10T16:38:24+0300,,Полный день,JavaScript|CSS3|HTML5|Git|jQuery|,"Что предлагаем? Интересные проекты с возможностью прокачаться в разных направлениях: еще шире изучить JS, либо стать full-stack-разработчиком или тимлидом;Белоснежные условия - оформление по ТК РФ, белая зарплата, отпускные и больничный; премии и бонусы, расширенный соц. пакет; а также стабильность и уверенность в завтрашнем дне (если ты понимаешь о чем мы);Удаленный формат работы - не нужно тратить время и силы, чтобы добраться до офиса! Рассмотрим твое резюме, даже если ты находишься на Сахалине;Гибкий график работы, который позволяет выспаться;Регулярные корпоративы (онлайн и оффлайн), бесплатное обучение, участие в профильных конференциях. Рассмотрим всех кандидатов. Особое предпочтение отдаём резюме с сопроводительными письмами и ссылками на код или живые проекты. Пиши о своем релевантном опыте и ожиданиях.        "
230,,Атос АйТи Солюшенс энд Сервисез,,,Полная занятость,От 3 до 6 лет,,,SAP CO,2020-12-25T11:41:29+0300,Требования: Практический опыт в FI (и желательно CO)Знание английского языка (разговорный уровень)Опыт в консалтингеЖелателен опыт работы на иностранных проектах ,Полный день,Работа в команде|Обучение и развитие|Деловая коммуникация|Английский язык|SAP FI|SAP CO|,"Условия: Компания предлагает стабильную и интересную работу, возможность профессионального развития;Изучение английского и немецкого языка;Предоставление дополнительных отпусков;Предоставление материальной помощи по особым случаям;Добровольное медицинское страхование (поликлиника, стоматология) - 100% компенсация для сотрудников компании;Компенсация питания сотрудника;Программа компенсаций занятий спортом;Программа награждения сотрудников за выдающиеся успехи;Удаленная работа, возможны редкие командировки."
231,Тюмень,Компания maxim,,,Полная занятость,От 1 года до 3 лет,150000,60000,Программист C#,2021-01-08T11:14:08+0300,,Полный день,,
232,Тюмень,Компания maxim,,"Обязанности: - анализ и формализация требований;<br />- постановка задач на разработку;<br />- консультация разработчиков/тестировщиков по поставленным задачам/выявленным ошибкам;<br />- проведение приемки реализованного решения;<br />- участие во внедрении ИТ-решений;<br />- написание документации (инструкции, ТЗ, пояснительные записки). ",Полная занятость,От 1 года до 3 лет,120000,70000,Постановка задач разработчикам,2020-12-31T11:59:00+0300,"Требования: - понимание принципов технологий, связанных с разработкой программного обеспечения (баз данных, WEB технологии);<br />- понимание того, как интегрируются друг с другом информационные системы/сервисы;<br />- умение моделировать предметную область, владение соответствующим инструментарием;<br />- базовые знания языка SQL;<br />- умение общаться с людьми, грамотно и четко излагать свои мысли &quot;на бумаге&quot;. ",Полный день,SQL|MS SQL|Разработка технических заданий|Навыки межличностного общения|Постановка задач разработчикам|,"Условия: - интересные задачи;<br />- дружелюбный коллектив;<br />- корпоративное обучение;<br />- поездки на it-конференции;<br />- комфортное рабочее место;<br />- компенсацию питания;<br />- бесплатные корпоративные мероприятия;<br />- уровень заработной платы, который зависит от технических знаний и навыков (+ регулярный пересмотр, если вы растете);<br />- оформление по ТК РФ;<br />- есть программа релокации."
233,,РН-Пурнефтегаз,,"Обязанности: Координировать работы подрядных организаций и обеспечивать их взаимодействие. Осуществлять надзор за ходом производства работ на объектах. Осуществлять согласование замены средств автоматизации на аналоги.Решать технические вопросы на объектах при их строительстве и реконструкции по разделу «Автоматизация». Принимать участие в работе комиссий по приемке законченных строительством объектов.Разрабатывать и реализовывать решения по техническому перевооружению систем автоматизации. Подготавливать материалы к техническим советам. Осуществлять исполнение решений протоколов технических совещаний.Анализировать причины отказов средств автоматизации, оформлять рекламаций в адрес изготовителей.Обеспечивать концептуальный подход к автоматизации производства и выполнять требования Стандарта компании «Автоматизированные системы управления технологическими процессами нефтегазодобычи. Требования к функциональным<br />характеристикам».Участвовать в разработке, формировании и защите бизнес-планов Общества и целевых программ по разделу «Автоматизация», осуществлять контроль над их исполнением. Выполнять подготовку мероприятий, графиков и отчетов о ходе работ по выполнению бизнес-плана. Формировать разовые и годовые заявки на приборную продукцию в системе Центральной заявочной компании (далее ЦЗК) SAP R/3, осуществлять контроль за их исполнением и распределением по объектам. Разрабатывать технические требования и технические задания (далее ТТ и ТЗ) на строительство и реконструкцию объектов, осуществлять рассмотрение и согласование проектов, опросных листов, проводить работу с проектными организациями в части принятия технических решений, типов оборудования и оптимизации систем. ",Полная занятость,Более 6 лет,,,Автоматизация технологических процессов,2020-12-11T15:35:57+0300,"Обязанности: Координировать работы подрядных организаций и обеспечивать их взаимодействие. Осуществлять надзор за ходом производства работ на объектах. Осуществлять согласование замены средств автоматизации на аналоги.Решать технические вопросы на объектах при их строительстве и реконструкции по разделу «Автоматизация». Принимать участие в работе комиссий по приемке законченных строительством объектов.Разрабатывать и реализовывать решения по техническому перевооружению систем автоматизации. Подготавливать материалы к техническим советам. Осуществлять исполнение решений протоколов технических совещаний.Анализировать причины отказов средств автоматизации, оформлять рекламаций в адрес изготовителей.Обеспечивать концептуальный подход к автоматизации производства и выполнять требования Стандарта компании «Автоматизированные системы управления технологическими процессами нефтегазодобычи. Требования к функциональным<br />характеристикам».Участвовать в разработке, формировании и защите бизнес-планов Общества и целевых программ по разделу «Автоматизация», осуществлять контроль над их исполнением. Выполнять подготовку мероприятий, графиков и отчетов о ходе работ по выполнению бизнес-плана. Формировать разовые и годовые заявки на приборную продукцию в системе Центральной заявочной компании (далее ЦЗК) SAP R/3, осуществлять контроль за их исполнением и распределением по объектам. Разрабатывать технические требования и технические задания (далее ТТ и ТЗ) на строительство и реконструкцию объектов, осуществлять рассмотрение и согласование проектов, опросных листов, проводить работу с проектными организациями в части принятия технических решений, типов оборудования и оптимизации систем. ",Полный день,управление технологическим процессом|Автоматизация процессов|Автоматизация|Аналитические способности|Оптимизация бизнес-процессов|Разработка технических заданий|Автоматизация технологических процессов|,Условия: постоянный метод работы в г.Губкинский ЯНАОсоциальные льготы и гарантии
234,Тюмень,Транспромжилстрой-2005,,"Обязанности: Администрирование рабочих станций WinXP, Win7,Win10;Администрирование Windows Server 2003, 2008, 2012R2;Администрирование офисной АТСТехническая поддержка офисной компьютерной техники и компьютерного оборудования;Подбор и закупка оборудования и программного обеспечения;Техническая и удаленная поддержка пользователей;Взаимодействие с операторами связи;Резервное копирование 1С;Обслуживание системы видеонаблюдения и телефонной связи;Создавать небольшие сайты;Опыт работы в ИТ технологиях. ",Полная занятость,От 3 до 6 лет,,,Системный администратор,2020-12-14T07:44:33+0300,"Требования: Опыт работы в аналогичной должности от 3-х лет. Знание линейки Microsoft Windows Server 2008/2012/2016/2018;  Знание технологий виртуализации - Hyper-V, VMWare; Знание принципов построения и защиты сетей; Опыт маршрутизации сетевого трафика; Опыт построения локальных сетей своими руками (кросс, монтаж розеток, патч-панелей); Опыт диагностики неисправностей; Умение решать возникающие проблемы удалённо.  ",Полный день,,Условия: Пятидневная рабочая неделя (пн-пт 09-00 - 18-00);Офис в центре города;Оформление согласно ТК РФ;Стабильная заработная плата;Заработная плата обсуждается на собеседовании.
