,city,company_name,description,duty,employment,experience,max_salary,min_salary,name,published_date,requirements,schedule,skills,terms
119,Тюмень,КейсГуру,"CaseGuru.RU – интернет-магазин, продающий беспроводные bluetooth-наушники, электронику и аксессуары для мобильных телефонов под брендом CaseGuru собственного производства по РФ и всему миру. Мы выходим на следующий уровень по объему продаж, доле рынка и автоматизации. По этой причине открыта вакансия «Интернет-маркетолог». У нас интересно работать, потому что мы постоянно решаем самые разные и сложные задачи. У нас масса бизнес-идей и амбициозных планов. Необходимые знания, опыт и компетенции: - Опыт работы в интернет-маркетинге (продажи или агентство).<br />- Знание методов, каналов, технологий продвижения в интернете.<br />- Понимание целей бизнеса, отдельных проектов, умение их достигать. Готовность вести проекты «под ключ».<br />- Высшее образование (реклама/маркетинг/экономика в приоритете).<br />- Инициативность, желание развиваться профессионально‚ пунктуальность. <br />Должностные обязанности: - Лидогенерация, привлечение горячего трафика в интернет-магазин.<br />- Разработка рекламных кампаний (таргетинг и ретаргетинг) в Яндексе (Директ, РСЯ), Гугле (КМС, поиск, Ютуб, Merchant Center), ФБ/Инстаграм, ВК (Mail Group). Поисковые, медийные и видео.<br />- Подготовка контента для РК (самостоятельно и с помощью дизайнеров).<br />- Настройка РК, контроль и повышение KPI, оперативная реакция на изменения показателей.<br />- SMM (ВК и ИГ, возможно новые сецсети). Охваты/вовлеченность, комьюнити-менеджент (самостоятельно и с помощью операторов колл-центра), виральный контент (посты, сторис, рост доли UGC-контента).<br />- Нативные интеграции с блогерами. Топовые федеральные селебрити и сеть мелких инфлюенсеров. Разные ниши (лафстайл, музыка, спорт, ЗОЖ и т.д.).<br />- Отзывы и работа с репутацией.<br />- CRM-менеджмент, e-mail-маркетинг и повторные продажи.<br />- Поиск новых сегментов ЦА, площадок присутствия, каналов трафика, креативов, офферов. Тестовые РК.<br />- Регулярная отчетность. <br />Мы предлагаем: - Официальное трудоустройство в соответствии с ТК РФ;<br />- Стабильный доход от 50 000 (определяется по результатам собеседования) + бонус за результативность. Реальную возможность раскрытия ваших личных способностей, роста ваших доходов и прочих побочных эффектов в кратном размере;<br />- Зарплата выплачивается стабильно два раза в месяц и без задержек.<br />- Современный светлый офис, где есть всё необходимое для плодотворной работы (современная техника, микроволновка, чай, кофемашина и др.);<br />- График работы: понедельник – пятница с 9 до 19;<br />- Широкие возможности для профессионального и карьерного развития; <br />О компании: За 2020 год мы достигли:<br />- Рост товарооборота в 7 раз<br />- Рост штата колл-центра в 3 раза<br />- Полная автоматизация бизнес-процессов и товародвижения<br />- Рост конверсии в 2 раза<br />- Более миллиона посетителей сайта<br />Планы на 2021 год:<br />- Рост товарооборота в 10 раз<br />- Выйти в лидеры среди российских производителей беспроводных наушников Добро пожаловать в команду!","CaseGuru.RU – интернет-магазин, продающий беспроводные bluetooth-наушники, электронику и аксессуары для мобильных телефонов под брендом CaseGuru собственного производства по РФ и всему миру. Мы выходим на следующий уровень по объему продаж, доле рынка и автоматизации. По этой причине открыта вакансия «Интернет-маркетолог». У нас интересно работать, потому что мы постоянно решаем самые разные и сложные задачи. У нас масса бизнес-идей и амбициозных планов. Необходимые знания, опыт и компетенции: - Опыт работы в интернет-маркетинге (продажи или агентство).<br />- Знание методов, каналов, технологий продвижения в интернете.<br />- Понимание целей бизнеса, отдельных проектов, умение их достигать. Готовность вести проекты «под ключ».<br />- Высшее образование (реклама/маркетинг/экономика в приоритете).<br />- Инициативность, желание развиваться профессионально‚ пунктуальность. <br />Должностные обязанности: - Лидогенерация, привлечение горячего трафика в интернет-магазин.<br />- Разработка рекламных кампаний (таргетинг и ретаргетинг) в Яндексе (Директ, РСЯ), Гугле (КМС, поиск, Ютуб, Merchant Center), ФБ/Инстаграм, ВК (Mail Group). Поисковые, медийные и видео.<br />- Подготовка контента для РК (самостоятельно и с помощью дизайнеров).<br />- Настройка РК, контроль и повышение KPI, оперативная реакция на изменения показателей.<br />- SMM (ВК и ИГ, возможно новые сецсети). Охваты/вовлеченность, комьюнити-менеджент (самостоятельно и с помощью операторов колл-центра), виральный контент (посты, сторис, рост доли UGC-контента).<br />- Нативные интеграции с блогерами. Топовые федеральные селебрити и сеть мелких инфлюенсеров. Разные ниши (лафстайл, музыка, спорт, ЗОЖ и т.д.).<br />- Отзывы и работа с репутацией.<br />- CRM-менеджмент, e-mail-маркетинг и повторные продажи.<br />- Поиск новых сегментов ЦА, площадок присутствия, каналов трафика, креативов, офферов. Тестовые РК.<br />- Регулярная отчетность. <br />Мы предлагаем: - Официальное трудоустройство в соответствии с ТК РФ;<br />- Стабильный доход от 50 000 (определяется по результатам собеседования) + бонус за результативность. Реальную возможность раскрытия ваших личных способностей, роста ваших доходов и прочих побочных эффектов в кратном размере;<br />- Зарплата выплачивается стабильно два раза в месяц и без задержек.<br />- Современный светлый офис, где есть всё необходимое для плодотворной работы (современная техника, микроволновка, чай, кофемашина и др.);<br />- График работы: понедельник – пятница с 9 до 19;<br />- Широкие возможности для профессионального и карьерного развития; <br />О компании: За 2020 год мы достигли:<br />- Рост товарооборота в 7 раз<br />- Рост штата колл-центра в 3 раза<br />- Полная автоматизация бизнес-процессов и товародвижения<br />- Рост конверсии в 2 раза<br />- Более миллиона посетителей сайта<br />Планы на 2021 год:<br />- Рост товарооборота в 10 раз<br />- Выйти в лидеры среди российских производителей беспроводных наушников Добро пожаловать в команду!",Полная занятость,От 3 до 6 лет,,60000,SMS маркетинг,2021-01-10T09:03:58+0300,,Полный день,Контекстная реклама|Продвижение сайтов|Интернет маркетинг|Развитие продаж|SMM|SMS маркетинг|,
120,Тюмень,ПРОМЕДСЕРВИС,,,Полная занятость,Нет опыта,,25000,испытания,2020-12-07T09:57:03+0300,,Полный день,Умение работать в команде|Электротехнические работы|Управление качеством|Техническая документация|медицинская техника|сервисное обслуживание|ремонт|испытания|,
121,,Сибнефтемаш,"Обязанности: Изготовление деталей на токарных станках с ЧПУ Умение изготавливать и контролировать резьбы: – Дюймовая резьба (K, R, G, NPT) – Метрическая резьба Резьбы нефтяного сортамента: – НКТ, НКТВ, Замковые, ОТТМ – Проточка и расточка цилиндрических поверхностей по Н7/h7 и чистотой Ra 1,25 – Изготовление пресс-форм Требования: Умение вести обработку на токарных станках с ЧПУ с умением составлять УП: -16К20Ф3 УЧПУ NC 210 -16К30Ф3 УЧПУ NC 210  ","Обязанности: Изготовление деталей на токарных станках с ЧПУ Умение изготавливать и контролировать резьбы: – Дюймовая резьба (K, R, G, NPT) – Метрическая резьба Резьбы нефтяного сортамента: – НКТ, НКТВ, Замковые, ОТТМ – Проточка и расточка цилиндрических поверхностей по Н7/h7 и чистотой Ra 1,25 – Изготовление пресс-форм Требования: Умение вести обработку на токарных станках с ЧПУ с умением составлять УП: -16К20Ф3 УЧПУ NC 210 -16К30Ф3 УЧПУ NC 210  ",Полная занятость,Нет опыта,55000,35000,Электронная почта,2020-12-17T09:57:35+0300,"Обязанности: Изготовление деталей на токарных станках с ЧПУ Умение изготавливать и контролировать резьбы: – Дюймовая резьба (K, R, G, NPT) – Метрическая резьба Резьбы нефтяного сортамента: – НКТ, НКТВ, Замковые, ОТТМ – Проточка и расточка цилиндрических поверхностей по Н7/h7 и чистотой Ra 1,25 – Изготовление пресс-форм Требования: Умение вести обработку на токарных станках с ЧПУ с умением составлять УП: -16К20Ф3 УЧПУ NC 210 -16К30Ф3 УЧПУ NC 210  ",Полный день,Работа с большим объемом информации|Умение работать в команде|Поиск информации в интернет|Работа в команде|Электронная почта|,
122,Тюмень,Интэкс,,Обязанности: Работа на токарных станках с программным управлением. ,Полная занятость,Нет опыта,,50000,Google Chrome,2021-01-08T10:03:22+0300,"Требования: Наличие профильного образования приветствуется.Дисциплинированность, внимательность, ответственное отношение к работе. ",Полный день,MS Access|Работа с базами данных|Умение работать в команде|Деловая переписка|Google Chrome|,"Условия: Официальное трудоустройство, пятидневная рабочая неделя с 08.00ч до 17.00ч (суббота и воскресенье выходной). Обучение на предприятии. Для уточнения возникших вопросов по данной вакансии звоните с 09-00 час. до 17-00 час. по указанному номеру телефону."
123,Тюмень,Легаси,,,Полная занятость,Нет опыта,80000,40000,Memcached,2020-12-18T13:06:24+0300,"Какие требования:  PHP 7, MySQL  GIT/GIT-flow  понимание ООП, опыт его использования  Отсутствие страха перед HTML, CSS, JS. Для верстки и сложного js-кодинга есть специальные люди, но базовые знания должны присутствовать и использоваться  Развиваться профессионально и помогать развиваться коллегам  ",Полный день,Веб разработка|Backend development|PHP|1С-Битрикс|JavaScript|Git|PostgreSQL|ООП|MySQL|Веб-программирование|Bitrix|SQL|Ajax|laravel|Memcached|,"Условия работы:  Работа в комфортном офисе с отдельным входом в центре города. До офиса удобно добираться на автобусе из любого района города, остановки рядом. Есть парковки для автомобилей  Профессиональная команда. Будет у кого поучиться новым технологиям, практикам и инструментам  Если требуется, покупаем новые инструменты для повышения эффективности работы  Опыт работы в реальных проектах федерального масштаба: интернет-магазины, маркетплейсы товаров и услуг, B2B-порталы.  Отличная рабочая атмосфера без дресс-кода и лишней бюрократии  Рабочая станция с SSD-диском и двумя мониторами  В офисе отдельный кабинет формата переговорка/кухня: холодильник, кофемашина, микроволновка, чайник, печеньки. Чистая питьевая бутилированная вода. Большие окна, свежий воздух, тишина  График работы обсуждаем: 5/2, 8-часовой рабочий день в период с 9-00 до 22-00, иногда можно работать из дома  Рядом: множество заведений общепита, тренажёрный зал, парикмахерская  Официальное оформление по ТК РФ с записью в трудовой книжке  Оплачиваемый испытательный срок 3 месяца. Обучаем в период испытательного срока    "
124,,Строительный Двор,,"Обязанности: оказание информационно-справочных услуг менеджерамтехническая поддержка (решение технических вопросов в процессе работы, различные ошибки в программе, настройки)решение организационных вопросов (выписка счетов, контроль оплат, сбор документов и пр.)подготовка регулярной отчетности. ",Полная занятость,Нет опыта,,35000,Специалист по информационной поддержке,2020-12-28T13:22:50+0300,"Требования: грамотная речь, способность вести телефонные переговоры, деловую перепискукоммуникабельность, энергичность, доброжелательность, высокая организованность, ответственностьспособность работать с большими объемами информации, в условиях сжатых сроков.стрессоустойчивость, умение разрешать конфликтные ситуации. ",Полный день,,"Требования: грамотная речь, способность вести телефонные переговоры, деловую перепискукоммуникабельность, энергичность, доброжелательность, высокая организованность, ответственностьспособность работать с большими объемами информации, в условиях сжатых сроков.стрессоустойчивость, умение разрешать конфликтные ситуации. "
125,Тюмень,КрепыЖ,,"Обязанности: Расширенные навыки программирования в среде 1С Предприятие (8.2, 8.3) - проектирование, анализ и корректировка ТЗНаписание и отладка кода и формРабота с направление 1С БухгалтерияТестирование и мониторингИнтеграция учетных данных со сторонними приложениями (ЭДО, CRM, WMS, системы анализа данных, информационные сайты и сайты продаж, базы данных <br />",Полная занятость,От 3 до 6 лет,,,Программист 1С,2020-12-22T08:41:57+0300,Требования: Опыт работы от 2х летДисциплинированностьПрофессионализмУверенные навыкиОбщая эрудированностьСамообразованиеКоммуникативность   ,Полный день,,Условия: Официальное трудоустройствоСвоевременная выплата заработной платыВозможность профессионального развитияРазвитая корпоративная культура  
126,Тюмень,КрепыЖ,,"Обязанности: Прием заявки (телефон, ЭДО, почта, скайп) и классификация на оперативную/неоперативнуюРазделение не оперативных заявок на тактические и стратегическиеПередача заявок в отдел на исполнениеАнализ задач, определение эффективного метода исполненияКонсультирование пользователя по текущей проблеме, фиксирование проблемы в ЭДОКонтроль текущих процессов по информационному обеспечению (информирование пользователей о изменении, введении новых процессов, смены условий и исполнителей в старых)Навыки программирования в базовом варианте: проверка выполнения алгоритмов, изменение шаблонов и форм ( приветствуется опыт работы с СКД), написание несложных внешних отчетов и обработокТестирование с пользователями созданных решений, передача разработчикам отзывов о разработке (плюсы и минусы)Заведение новых пользователей в 1С с назначением соответствующих наборов прав, изменение существующих наборов по согласованию со службой HR и руководством подразделенияВедения ежемесячного (2 раза в месяц) собрания постановщиков задач, для анализа разработки текущих задач и постановки в очередь следующих, с назначением приоритетов ",Полная занятость,От 1 года до 3 лет,,30000,Специалист поддержки IT (первая линия),2020-12-22T08:41:57+0300,Требования: Опыт работы обязателенПунктуальностьКоммуникабельностьСтрессоустойчивостьОбратите внимание необходимы знания и навыки в сфере IT  ,Полный день,,Условия: Официальное трудоустройствоСтабильная выплата заработной платыРабочее место: ул.АвторемонтнаяГрафик работы 5/2Развитая корпоративная культура
