,city,company_name,description,duty,employment,experience,max_salary,min_salary,name,published_date,requirements,schedule,skills,terms
328,Тюмень,КейсГуру,,"Должностные обязанности: - Контроль за работой розничных менеджеров интернет-магазина (от 6 сотрудников), соблюдением внутренних регламентов Компании, производственной дисциплиной, движением и конверсией заказов.<br />- Внедрение скриптов, регламентов и инструкций, обучение и стажировка розничных менеджеров, оптимизация бизнес-процессов.<br />- Контроль и повышение эффективности KPI колл-центра (конверсия, средний чек, скорость обработки заказов).<br />- Администрирование RetailCRM (самостоятельно или с помощью специалистов).<br />- Контроль подразделения, работающего с обращениями по гарантии и качеству товаров.<br />- При крайней необходимости работа с клиентами интернет-магазина‚ оперативная обработка и подтверждение заказов, консультирование по товарам, условиям продажи и доставки.<br />- Оперативное решение возникающих вопросов и задач.<br />- Составление отчетности. ",Полная занятость,От 3 до 6 лет,,60000,Грамотность,2021-01-10T16:24:09+0300,,Полный день,Пользователь ПК|Грамотная речь|Организаторские навыки|Обучение персонала|Подбор персонала|Навыки продаж|Телефонные переговоры|Работа в команде|Клиентоориентированность|Консультирование клиентов по телефону|CRM|Продажи через интернет|Оптимизация бизнес-процессов|Управление эффективностью|Управление процессами|Мотивация персонала|Ориентация на результат|Работа с большим объемом информации|Мотивация|Работа с жалобами клиентов|Розничная торговля|Управление персоналом|Должностные инструкции|Системное мышление|Грамотность|,"Должностные обязанности: - Контроль за работой розничных менеджеров интернет-магазина (от 6 сотрудников), соблюдением внутренних регламентов Компании, производственной дисциплиной, движением и конверсией заказов.<br />- Внедрение скриптов, регламентов и инструкций, обучение и стажировка розничных менеджеров, оптимизация бизнес-процессов.<br />- Контроль и повышение эффективности KPI колл-центра (конверсия, средний чек, скорость обработки заказов).<br />- Администрирование RetailCRM (самостоятельно или с помощью специалистов).<br />- Контроль подразделения, работающего с обращениями по гарантии и качеству товаров.<br />- При крайней необходимости работа с клиентами интернет-магазина‚ оперативная обработка и подтверждение заказов, консультирование по товарам, условиям продажи и доставки.<br />- Оперативное решение возникающих вопросов и задач.<br />- Составление отчетности. "
329,Тюмень,Шлюмберже,,Обязанности: Разработка расширений для программного обеспечения Schlumberger (платформы Petrel) с использованием Ocean API. ,Полная занятость,От 1 года до 3 лет,,,SQL,2020-12-24T13:08:46+0300,"Требования: Высшее образование в области инженерии, информатики, информационных систем или в смежных областях;Желание изучать новые технологии;Опыт работы с С# от 1 года;Английский от уровня Pre-Intermediate. ",Полный день,Английский язык|Информационные технологии|C#|Python|Qt|MySQL|Git|SQL|,"Условия: Продвижение, основанное на производительности;Программа обучения и развития;Удаленная работа;40-часовая рабочая неделя, гибкий график. "
330,Тюмень,Шлюмберже,,"Обязанности:  Настройка, наладка и обслуживание станков с ЧПУ Разработка программ для станков с числовым программным управлением. Контроль и изготовление продукции Отладка, изготовление пробных деталей и сдача их в ОТК.Корректировка режимов резания по результатам работы станка. ",Полная занятость,От 3 до 6 лет,,,Станки ЧПУ,2020-12-17T14:42:53+0300,"Требования: Средне-специальное техническое образование.Опыт работы на стойке fanuk (HAAS, LITS, TUR)Опыт работы на данной позиции не меньше 1 года ",Полный день,Станки ЧПУ|,Условия: Работа на заводе ТОЭЗГП (Тюменский опытно-экспериментальный завод геофизического приборостроения)Конкурентная заработная плата.Трудоустройство в соответствии с ТК РФ.Соц. пакет.
331,,Тинькофф,"Требования: <ol> <li>Знание Java (с опытом работы в Dev-командах)Знание скриптовых языков (Bash, Python)Понимание как устроен JVMПонимание принципов построения микросервисной архитектурыПонимание принципов обеспечения надежности сервисовГотовность работать с Production окружением</li> </ol> Задачи: <ol> <li>Оптимизация имеющихся систем, уменьшение нагрузки на сопровождение и обслуживание систем за счет автоматизацииПоиск возможных проблем в архитектуре систем и их устранениеОбслуживание работающих сервисов, включая мониторинг как системных, так и бизнес метрик (SLA)Выявление потенциальных сценариев отказа системыУчастие в расследовании и устранении причин сбоев</li> </ol> Мы предлагаем: <ol> <li>Комфортная для тебя заработная плата (обсудим ее на собеседовании)Работа в современном офисе в центре городаХорошо оборудованное рабочее место с компьютером, который тебе потребуетсяПолис ДМС со стоматологией и страховка от несчастных случаев для тебя, а также льготные условия страхования для близкихКомпенсация обедов, такси (300 ₽ в день)Чай, кофе и конфеты на кухне50% компенсация спорта и фитнесаПрофессиональное развитие. Проводим митапы, тренинги и мастер-классы, дадим доступ к огромной технической библиотекеСкидка 30% на КАСКО и другие специальные условия на продукты компании.</li> </ol>",,Полная занятость,От 1 года до 3 лет,,,Devops,2020-12-21T10:07:04+0300,"Требования: <ol> <li>Знание Java (с опытом работы в Dev-командах)Знание скриптовых языков (Bash, Python)Понимание как устроен JVMПонимание принципов построения микросервисной архитектурыПонимание принципов обеспечения надежности сервисовГотовность работать с Production окружением</li> </ol> Задачи: <ol> <li>Оптимизация имеющихся систем, уменьшение нагрузки на сопровождение и обслуживание систем за счет автоматизацииПоиск возможных проблем в архитектуре систем и их устранениеОбслуживание работающих сервисов, включая мониторинг как системных, так и бизнес метрик (SLA)Выявление потенциальных сценариев отказа системыУчастие в расследовании и устранении причин сбоев</li> </ol> Мы предлагаем: <ol> <li>Комфортная для тебя заработная плата (обсудим ее на собеседовании)Работа в современном офисе в центре городаХорошо оборудованное рабочее место с компьютером, который тебе потребуетсяПолис ДМС со стоматологией и страховка от несчастных случаев для тебя, а также льготные условия страхования для близкихКомпенсация обедов, такси (300 ₽ в день)Чай, кофе и конфеты на кухне50% компенсация спорта и фитнесаПрофессиональное развитие. Проводим митапы, тренинги и мастер-классы, дадим доступ к огромной технической библиотекеСкидка 30% на КАСКО и другие специальные условия на продукты компании.</li> </ol>",Удаленная работа,Python|Java|SRE|Bash|Devops|,"Требования: <ol> <li>Знание Java (с опытом работы в Dev-командах)Знание скриптовых языков (Bash, Python)Понимание как устроен JVMПонимание принципов построения микросервисной архитектурыПонимание принципов обеспечения надежности сервисовГотовность работать с Production окружением</li> </ol> Задачи: <ol> <li>Оптимизация имеющихся систем, уменьшение нагрузки на сопровождение и обслуживание систем за счет автоматизацииПоиск возможных проблем в архитектуре систем и их устранениеОбслуживание работающих сервисов, включая мониторинг как системных, так и бизнес метрик (SLA)Выявление потенциальных сценариев отказа системыУчастие в расследовании и устранении причин сбоев</li> </ol> Мы предлагаем: <ol> <li>Комфортная для тебя заработная плата (обсудим ее на собеседовании)Работа в современном офисе в центре городаХорошо оборудованное рабочее место с компьютером, который тебе потребуетсяПолис ДМС со стоматологией и страховка от несчастных случаев для тебя, а также льготные условия страхования для близкихКомпенсация обедов, такси (300 ₽ в день)Чай, кофе и конфеты на кухне50% компенсация спорта и фитнесаПрофессиональное развитие. Проводим митапы, тренинги и мастер-классы, дадим доступ к огромной технической библиотекеСкидка 30% на КАСКО и другие специальные условия на продукты компании.</li> </ol>"
332,,"ЮТэйр, Авиакомпания",,"Обязанности: Сбор и систематизация данных об ИТ архитектуре производственных систем (ТОРО) Группы компаний Utair. Описание вариантов целевой архитектуры, транзитных архитектур, формирование дорожных карт.Подготовка архитектурных схем по запросам Компании и внешних аудиторов.Участие в проектах по автоматизации бизнес-процессов ТОРО: составление ФТТ (Функциональные и технические требования), ТЗ (Техническое задание), архитектурный надзор.Разработка проектной документации в части ИТ архитектуры (в т.ч. интеграционных решений и решений по управлению НСИ).Подготовка предложений по развитию информационных систем Группы компаний.Аудит внедрения и текущего состояния информационных систем на соответствие разработанной проектной документации.Проведение анализа и согласование технической документации на предмет соответствия требованиям Компании.Подготовка предложений по старту пилотных проектов развития.Подготовка предложений по оптимизации ИТ архитектуры. ",Полная занятость,От 3 до 6 лет,,,ТОРО,2020-12-28T13:32:39+0300,"Обязанности: Сбор и систематизация данных об ИТ архитектуре производственных систем (ТОРО) Группы компаний Utair. Описание вариантов целевой архитектуры, транзитных архитектур, формирование дорожных карт.Подготовка архитектурных схем по запросам Компании и внешних аудиторов.Участие в проектах по автоматизации бизнес-процессов ТОРО: составление ФТТ (Функциональные и технические требования), ТЗ (Техническое задание), архитектурный надзор.Разработка проектной документации в части ИТ архитектуры (в т.ч. интеграционных решений и решений по управлению НСИ).Подготовка предложений по развитию информационных систем Группы компаний.Аудит внедрения и текущего состояния информационных систем на соответствие разработанной проектной документации.Проведение анализа и согласование технической документации на предмет соответствия требованиям Компании.Подготовка предложений по старту пилотных проектов развития.Подготовка предложений по оптимизации ИТ архитектуры. ",Удаленная работа,BPMN|Оптимизация бизнес-процессов|Моделирование бизнес процессов|Управление проектами|AutoCAD|Автоматизация бизнес-процессов|ArchiCAD|MS Project|Бизнес-анализ|Системное мышление|Разработка проектной документации|ГОСТ|Микросервисная архитектура|ТОРО|,"Условия:  место работы: удаленная работа с эпизодическими непродолжительными командировками в Тюмень, Москву, Краснодар;  график работы: пятидневная рабочая неделя 09.00-18.00;  испытательный срок 3 месяца;  оформление в соответствии с ТК РФ;  заработная плата договорная, выплачивается своевременно, два раза в месяц. Рассматриваются зарплатные ожидания кандидатов;  льготы для сотрудников и членов семьи на авиаперелеты к месту отпуска.   "
333,,Сервис Финанс Консалтинг,<em>,,Полная занятость,От 3 до 6 лет,70000,50000,Яндекс.Метрика,2020-12-12T09:35:57+0300,,Полный день,B2B маркетинг|B2C маркетинг|Продвижение бренда|Планирование маркетинговых кампаний|Медиапланирование|Стратегический маркетинг|Internet Marketing|Интернет маркетинг|Вывод продукта на рынок|Управление бюджетом|Организация промо акций|Веб-аналитика|Конкурентная аналитика|Microsoft power BI|Контекстная реклама|Медийная реклама|Таргетированная реклама|Копирайтинг|Планирование рекламных кампаний|Google Analytics|Яндекс.Метрика|,"Finleo.ru</em> — это активно развивающийся маркетплейс услуг и консалтинговая компания в финансовом секторе с опытом более 13 лет. Мы ищем интернет-маркетолога, который готов не только предлагать тактику продвижения проектов, но и доводить согласованные идеи до результата. Маркетплейс дает <em>партнерам </em>возможность разместить свои финансовые продукты, <em>пользователям - </em>привлечь на них покупателей и заработать вознаграждение, а наш консалтинг помогает <em>компаниям</em> от малого до крупного бизнеса получить финансовые продукты на лучших условиях. Наша миссия: стать одним из крупнейших работодателей РФ и вывести качество консалтинговых услуг на принципиально новый уровень. Сейчас мы стабильная и активно развивающаяся финтех компания, но для достижения всех целей нам нужно больше талантливых людей. Успей присоединиться к нам и получи возможность проявить себя! "
334,Тюмень,Шлюмберже,,"Обязанности:  Настройка, наладка и обслуживание станков с ЧПУ Разработка программ для станков с числовым программным управлением. Контроль и изготовление продукции Отладка, изготовление пробных деталей и сдача их в ОТК.Корректировка режимов резания по результатам работы станка. ",Полная занятость,От 3 до 6 лет,,,Станки ЧПУ,2020-12-11T10:00:04+0300,"Требования: Средне-специальное техническое образование.Опыт работы на стойке fanuk (HAAS, LITS, TUR)Опыт работы на данной позиции не меньше 1 года ",Полный день,Станки ЧПУ|,Условия: Работа на заводе ТОЭЗГП (Тюменский опытно-экспериментальный завод геофизического приборостроения)Конкурентная заработная плата.Трудоустройство в соответствии с ТК РФ.Соц. пакет.
